{
  "$schema": "https://recursive-dev-loop.dev/schemas/improvement-proposal.v1.schema.json",
  "schema_version": "1.0.0",
  "proposal_id": "prop-observed-example",
  "title": "Reduce repeated local validation work",
  "created_at": "2026-08-27T14:00:00.000Z",
  "source_feedback_ids": [
    "fb-completed-example"
  ],
  "objective": "Preserve behavior while reducing repeated local validation work.",
  "target": {
    "kind": "harness_rule",
    "uri": "repo://AGENTS.md",
    "base_sha256": "aaaaaaaaaaaaaaaaaaaaaaaaaaaaaaaaaaaaaaaaaaaaaaaaaaaaaaaaaaaaaaaa",
    "surface": "stop_retry_logic"
  },
  "stage": "observed",
  "prediction": null,
  "candidate": null,
  "evaluation": null,
  "decision_ref": null,
  "history": [
    {
      "from": null,
      "to": "observed",
      "actor": {
        "kind": "dsh-agent",
        "id": "agent-local"
      },
      "at": "2026-08-27T14:00:00.000Z",
      "evidence": [
        "repo://tests/fixtures/feedback/completed.json"
      ],
      "notes": "The repeated validation work was observed locally."
    }
  ],
  "measurements": []
}
